lsb_release -a:

Distributor ID:	Ubuntu
Description:	Ubuntu 18.04.3 LTS
Release:	18.04
Codename:	bionic


uname -a:

Linux regev-ubuntu 5.4.0-42-generic #46~18.04.1-Ubuntu SMP Fri Jul 10 07:21:24 UTC 2020 x86_64 x86_64 x86_64 GNU/Linux


lspci:

00:00.0 Host bridge: Intel Corporation Device 3e30 (rev 0d)
00:01.0 PCI bridge: Intel Corporation Xeon E3-1200 v5/E3-1500 v5/6th Gen Core Processor PCIe Controller (x16) (rev 0d)
00:12.0 Signal processing controller: Intel Corporation Cannon Lake PCH Thermal Controller (rev 10)
00:14.0 USB controller: Intel Corporation Cannon Lake PCH USB 3.1 xHCI Host Controller (rev 10)
00:14.2 RAM memory: Intel Corporation Cannon Lake PCH Shared SRAM (rev 10)
00:16.0 Communication controller: Intel Corporation Cannon Lake PCH HECI Controller (rev 10)
00:17.0 SATA controller: Intel Corporation Cannon Lake PCH SATA AHCI Controller (rev 10)
00:1f.0 ISA bridge: Intel Corporation H370 Chipset LPC/eSPI Controller (rev 10)
00:1f.3 Audio device: Intel Corporation Cannon Lake PCH cAVS (rev 10)
00:1f.4 SMBus: Intel Corporation Cannon Lake PCH SMBus Controller (rev 10)
00:1f.5 Serial bus controller [0c80]: Intel Corporation Cannon Lake PCH SPI Controller (rev 10)
00:1f.6 Ethernet controller: Intel Corporation Ethernet Connection (7) I219-V (rev 10)
01:00.0 VGA compatible controller: NVIDIA Corporation GV102 (rev a1)
01:00.1 Audio device: NVIDIA Corporation Device 10f7 (rev a1)
01:00.2 USB controller: NVIDIA Corporation Device 1ad6 (rev a1)
01:00.3 Serial bus controller [0c80]: NVIDIA Corporation Device 1ad7 (rev a1)


lsusb:

Bus 002 Device 004: ID 1e10:4000 Point Grey Research, Inc. 
Bus 002 Device 003: ID 1e10:4000 Point Grey Research, Inc. 
Bus 002 Device 002: ID 1e10:4000 Point Grey Research, Inc. 
Bus 002 Device 001: ID 1d6b:0003 Linux Foundation 3.0 root hub
Bus 001 Device 004: ID 2341:0043 Arduino SA Uno R3 (CDC ACM)
Bus 001 Device 003: ID 2575:0001  
Bus 001 Device 002: ID 1e10:4000 Point Grey Research, Inc. 
Bus 001 Device 001: ID 1d6b:0002 Linux Foundation 2.0 root hub
Bus 004 Device 001: ID 1d6b:0003 Linux Foundation 3.0 root hub
Bus 003 Device 001: ID 1d6b:0002 Linux Foundation 2.0 root hub


lsusb -t:

/:  Bus 04.Port 1: Dev 1, Class=root_hub, Driver=xhci_hcd/4p, 10000M
/:  Bus 03.Port 1: Dev 1, Class=root_hub, Driver=xhci_hcd/2p, 480M
/:  Bus 02.Port 1: Dev 1, Class=root_hub, Driver=xhci_hcd/8p, 10000M
    |__ Port 1: Dev 2, If 2, Class=Miscellaneous Device, Driver=usbfs, 5000M
    |__ Port 1: Dev 2, If 0, Class=Miscellaneous Device, Driver=, 5000M
    |__ Port 1: Dev 2, If 1, Class=Miscellaneous Device, Driver=usbfs, 5000M
    |__ Port 2: Dev 3, If 2, Class=Miscellaneous Device, Driver=usbfs, 5000M
    |__ Port 2: Dev 3, If 0, Class=Miscellaneous Device, Driver=, 5000M
    |__ Port 2: Dev 3, If 1, Class=Miscellaneous Device, Driver=usbfs, 5000M
    |__ Port 3: Dev 4, If 0, Class=Miscellaneous Device, Driver=, 5000M
    |__ Port 3: Dev 4, If 1, Class=Miscellaneous Device, Driver=usbfs, 5000M
    |__ Port 3: Dev 4, If 2, Class=Miscellaneous Device, Driver=usbfs, 5000M
/:  Bus 01.Port 1: Dev 1, Class=root_hub, Driver=xhci_hcd/16p, 480M
    |__ Port 7: Dev 2, If 2, Class=Miscellaneous Device, Driver=, 480M
    |__ Port 7: Dev 2, If 0, Class=Miscellaneous Device, Driver=, 480M
    |__ Port 7: Dev 2, If 1, Class=Miscellaneous Device, Driver=, 480M
    |__ Port 8: Dev 3, If 0, Class=Human Interface Device, Driver=usbhid, 12M
    |__ Port 9: Dev 4, If 0, Class=Communications, Driver=cdc_acm, 12M
    |__ Port 9: Dev 4, If 1, Class=CDC Data, Driver=cdc_acm, 12M


lsusb -v:


Bus 002 Device 004: ID 1e10:4000 Point Grey Research, Inc. 
Device Descriptor:
  bLength                18
  bDescriptorType         1
  bcdUSB               3.00
  bDeviceClass          239 Miscellaneous Device
  bDeviceSubClass         2 ?
  bDeviceProtocol         1 Interface Association
  bMaxPacketSize0         9
  idVendor           0x1e10 Point Grey Research, Inc.
  idProduct          0x4000 
  bcdDevice            0.00
  iManufacturer           1 FLIR
  iProduct                2 U3V camera
  iSerial                 3 19506468
  bNumConfigurations      1
  Configuration Descriptor:
    bLength                 9
    bDescriptorType         2
    wTotalLength          116
    bNumInterfaces          3
    bConfigurationValue     1
    iConfiguration          0 
    bmAttributes         0x80
      (Bus Powered)
    MaxPower               38mA
    Interface Association:
      bLength                 8
      bDescriptorType        11
      bFirstInterface         0
      bInterfaceCount         3
      bFunctionClass        239 Miscellaneous Device
      bFunctionSubClass       5 USB3 Vision
      bFunctionProtocol       0 
      iFunction               4 USB3 Vision Device
    Interface Descriptor:
      bLength                 9
      bDescriptorType         4
      bInterfaceNumber        0
      bAlternateSetting       0
      bNumEndpoints           2
      bInterfaceClass       239 Miscellaneous Device
      bInterfaceSubClass      5 USB3 Vision
      bInterfaceProtocol      0 
      iInterface              5 Control Interface
      ** UNRECOGNIZED:  14 24 01 00 00 01 00 00 00 01 00 06 07 08 09 0a 0b 03 0c 0c
      Endpoint Descriptor:
        bLength                 7
        bDescriptorType         5
        bEndpointAddress     0x02  EP 2 OUT
        bmAttributes            2
          Transfer Type            Bulk
          Synch Type               None
          Usage Type               Data
        wMaxPacketSize     0x0400  1x 1024 bytes
        bInterval               0
        bMaxBurst               0
      Endpoint Descriptor:
        bLength                 7
        bDescriptorType         5
        bEndpointAddress     0x82  EP 2 IN
        bmAttributes            2
          Transfer Type            Bulk
          Synch Type               None
          Usage Type               Data
        wMaxPacketSize     0x0400  1x 1024 bytes
        bInterval               0
        bMaxBurst               0
    Interface Descriptor:
      bLength                 9
      bDescriptorType         4
      bInterfaceNumber        1
      bAlternateSetting       0
      bNumEndpoints           1
      bInterfaceClass       239 Miscellaneous Device
      bInterfaceSubClass      5 USB3 Vision
      bInterfaceProtocol      1 
      iInterface             13 Event Interface
      Endpoint Descriptor:
        bLength                 7
        bDescriptorType         5
        bEndpointAddress     0x83  EP 3 IN
        bmAttributes            2
          Transfer Type            Bulk
          Synch Type               None
          Usage Type               Data
        wMaxPacketSize     0x0400  1x 1024 bytes
        bInterval               0
        bMaxBurst               0
    Interface Descriptor:
      bLength                 9
      bDescriptorType         4
      bInterfaceNumber        2
      bAlternateSetting       0
      bNumEndpoints           1
      bInterfaceClass       239 Miscellaneous Device
      bInterfaceSubClass      5 USB3 Vision
      bInterfaceProtocol      2 
      iInterface             14 Streaming Interface
      Endpoint Descriptor:
        bLength                 7
        bDescriptorType         5
        bEndpointAddress     0x81  EP 1 IN
        bmAttributes            2
          Transfer Type            Bulk
          Synch Type               None
          Usage Type               Data
        wMaxPacketSize     0x0400  1x 1024 bytes
        bInterval               0
        bMaxBurst              15
Binary Object Store Descriptor:
  bLength                 5
  bDescriptorType        15
  wTotalLength           22
  bNumDeviceCaps          2
  USB 2.0 Extension Device Capability:
    bLength                 7
    bDescriptorType        16
    bDevCapabilityType      2
    bmAttributes   0x00000006
      Link Power Management (LPM) Supported
  SuperSpeed USB Device Capability:
    bLength                10
    bDescriptorType        16
    bDevCapabilityType      3
    bmAttributes         0x00
    wSpeedsSupported   0x000e
      Device can operate at Full Speed (12Mbps)
      Device can operate at High Speed (480Mbps)
      Device can operate at SuperSpeed (5Gbps)
    bFunctionalitySupport   1
      Lowest fully-functional device speed is Full Speed (12Mbps)
    bU1DevExitLat          10 micro seconds
    bU2DevExitLat          32 micro seconds
Device Status:     0x000c
  (Bus Powered)
  U1 Enabled
  U2 Enabled

Bus 002 Device 003: ID 1e10:4000 Point Grey Research, Inc. 
Device Descriptor:
  bLength                18
  bDescriptorType         1
  bcdUSB               3.00
  bDeviceClass          239 Miscellaneous Device
  bDeviceSubClass         2 ?
  bDeviceProtocol         1 Interface Association
  bMaxPacketSize0         9
  idVendor           0x1e10 Point Grey Research, Inc.
  idProduct          0x4000 
  bcdDevice            0.00
  iManufacturer           1 FLIR
  iProduct                2 U3V camera
  iSerial                 3 19506475
  bNumConfigurations      1
  Configuration Descriptor:
    bLength                 9
    bDescriptorType         2
    wTotalLength          116
    bNumInterfaces          3
    bConfigurationValue     1
    iConfiguration          0 
    bmAttributes         0x80
      (Bus Powered)
    MaxPower               38mA
    Interface Association:
      bLength                 8
      bDescriptorType        11
      bFirstInterface         0
      bInterfaceCount         3
      bFunctionClass        239 Miscellaneous Device
      bFunctionSubClass       5 USB3 Vision
      bFunctionProtocol       0 
      iFunction               4 USB3 Vision Device
    Interface Descriptor:
      bLength                 9
      bDescriptorType         4
      bInterfaceNumber        0
      bAlternateSetting       0
      bNumEndpoints           2
      bInterfaceClass       239 Miscellaneous Device
      bInterfaceSubClass      5 USB3 Vision
      bInterfaceProtocol      0 
      iInterface              5 Control Interface
      ** UNRECOGNIZED:  14 24 01 00 00 01 00 00 00 01 00 06 07 08 09 0a 0b 03 0c 0c
      Endpoint Descriptor:
        bLength                 7
        bDescriptorType         5
        bEndpointAddress     0x02  EP 2 OUT
        bmAttributes            2
          Transfer Type            Bulk
          Synch Type               None
          Usage Type               Data
        wMaxPacketSize     0x0400  1x 1024 bytes
        bInterval               0
        bMaxBurst               0
      Endpoint Descriptor:
        bLength                 7
        bDescriptorType         5
        bEndpointAddress     0x82  EP 2 IN
        bmAttributes            2
          Transfer Type            Bulk
          Synch Type               None
          Usage Type               Data
        wMaxPacketSize     0x0400  1x 1024 bytes
        bInterval               0
        bMaxBurst               0
    Interface Descriptor:
      bLength                 9
      bDescriptorType         4
      bInterfaceNumber        1
      bAlternateSetting       0
      bNumEndpoints           1
      bInterfaceClass       239 Miscellaneous Device
      bInterfaceSubClass      5 USB3 Vision
      bInterfaceProtocol      1 
      iInterface             13 Event Interface
      Endpoint Descriptor:
        bLength                 7
        bDescriptorType         5
        bEndpointAddress     0x83  EP 3 IN
        bmAttributes            2
          Transfer Type            Bulk
          Synch Type               None
          Usage Type               Data
        wMaxPacketSize     0x0400  1x 1024 bytes
        bInterval               0
        bMaxBurst               0
    Interface Descriptor:
      bLength                 9
      bDescriptorType         4
      bInterfaceNumber        2
      bAlternateSetting       0
      bNumEndpoints           1
      bInterfaceClass       239 Miscellaneous Device
      bInterfaceSubClass      5 USB3 Vision
      bInterfaceProtocol      2 
      iInterface             14 Streaming Interface
      Endpoint Descriptor:
        bLength                 7
        bDescriptorType         5
        bEndpointAddress     0x81  EP 1 IN
        bmAttributes            2
          Transfer Type            Bulk
          Synch Type               None
          Usage Type               Data
        wMaxPacketSize     0x0400  1x 1024 bytes
        bInterval               0
        bMaxBurst              15
Binary Object Store Descriptor:
  bLength                 5
  bDescriptorType        15
  wTotalLength           22
  bNumDeviceCaps          2
  USB 2.0 Extension Device Capability:
    bLength                 7
    bDescriptorType        16
    bDevCapabilityType      2
    bmAttributes   0x00000006
      Link Power Management (LPM) Supported
  SuperSpeed USB Device Capability:
    bLength                10
    bDescriptorType        16
    bDevCapabilityType      3
    bmAttributes         0x00
    wSpeedsSupported   0x000e
      Device can operate at Full Speed (12Mbps)
      Device can operate at High Speed (480Mbps)
      Device can operate at SuperSpeed (5Gbps)
    bFunctionalitySupport   1
      Lowest fully-functional device speed is Full Speed (12Mbps)
    bU1DevExitLat          10 micro seconds
    bU2DevExitLat          32 micro seconds
Device Status:     0x000c
  (Bus Powered)
  U1 Enabled
  U2 Enabled

Bus 002 Device 002: ID 1e10:4000 Point Grey Research, Inc. 
Device Descriptor:
  bLength                18
  bDescriptorType         1
  bcdUSB               3.00
  bDeviceClass          239 Miscellaneous Device
  bDeviceSubClass         2 ?
  bDeviceProtocol         1 Interface Association
  bMaxPacketSize0         9
  idVendor           0x1e10 Point Grey Research, Inc.
  idProduct          0x4000 
  bcdDevice            0.00
  iManufacturer           1 FLIR
  iProduct                2 U3V camera
  iSerial                 3 19506455
  bNumConfigurations      1
  Configuration Descriptor:
    bLength                 9
    bDescriptorType         2
    wTotalLength          116
    bNumInterfaces          3
    bConfigurationValue     1
    iConfiguration          0 
    bmAttributes         0x80
      (Bus Powered)
    MaxPower               38mA
    Interface Association:
      bLength                 8
      bDescriptorType        11
      bFirstInterface         0
      bInterfaceCount         3
      bFunctionClass        239 Miscellaneous Device
      bFunctionSubClass       5 USB3 Vision
      bFunctionProtocol       0 
      iFunction               4 USB3 Vision Device
    Interface Descriptor:
      bLength                 9
      bDescriptorType         4
      bInterfaceNumber        0
      bAlternateSetting       0
      bNumEndpoints           2
      bInterfaceClass       239 Miscellaneous Device
      bInterfaceSubClass      5 USB3 Vision
      bInterfaceProtocol      0 
      iInterface              5 Control Interface
      ** UNRECOGNIZED:  14 24 01 00 00 01 00 00 00 01 00 06 07 08 09 0a 0b 03 0c 0c
      Endpoint Descriptor:
        bLength                 7
        bDescriptorType         5
        bEndpointAddress     0x02  EP 2 OUT
        bmAttributes            2
          Transfer Type            Bulk
          Synch Type               None
          Usage Type               Data
        wMaxPacketSize     0x0400  1x 1024 bytes
        bInterval               0
        bMaxBurst               0
      Endpoint Descriptor:
        bLength                 7
        bDescriptorType         5
        bEndpointAddress     0x82  EP 2 IN
        bmAttributes            2
          Transfer Type            Bulk
          Synch Type               None
          Usage Type               Data
        wMaxPacketSize     0x0400  1x 1024 bytes
        bInterval               0
        bMaxBurst               0
    Interface Descriptor:
      bLength                 9
      bDescriptorType         4
      bInterfaceNumber        1
      bAlternateSetting       0
      bNumEndpoints           1
      bInterfaceClass       239 Miscellaneous Device
      bInterfaceSubClass      5 USB3 Vision
      bInterfaceProtocol      1 
      iInterface             13 Event Interface
      Endpoint Descriptor:
        bLength                 7
        bDescriptorType         5
        bEndpointAddress     0x83  EP 3 IN
        bmAttributes            2
          Transfer Type            Bulk
          Synch Type               None
          Usage Type               Data
        wMaxPacketSize     0x0400  1x 1024 bytes
        bInterval               0
        bMaxBurst               0
    Interface Descriptor:
      bLength                 9
      bDescriptorType         4
      bInterfaceNumber        2
      bAlternateSetting       0
      bNumEndpoints           1
      bInterfaceClass       239 Miscellaneous Device
      bInterfaceSubClass      5 USB3 Vision
      bInterfaceProtocol      2 
      iInterface             14 Streaming Interface
      Endpoint Descriptor:
        bLength                 7
        bDescriptorType         5
        bEndpointAddress     0x81  EP 1 IN
        bmAttributes            2
          Transfer Type            Bulk
          Synch Type               None
          Usage Type               Data
        wMaxPacketSize     0x0400  1x 1024 bytes
        bInterval               0
        bMaxBurst              15
Binary Object Store Descriptor:
  bLength                 5
  bDescriptorType        15
  wTotalLength           22
  bNumDeviceCaps          2
  USB 2.0 Extension Device Capability:
    bLength                 7
    bDescriptorType        16
    bDevCapabilityType      2
    bmAttributes   0x00000006
      Link Power Management (LPM) Supported
  SuperSpeed USB Device Capability:
    bLength                10
    bDescriptorType        16
    bDevCapabilityType      3
    bmAttributes         0x00
    wSpeedsSupported   0x000e
      Device can operate at Full Speed (12Mbps)
      Device can operate at High Speed (480Mbps)
      Device can operate at SuperSpeed (5Gbps)
    bFunctionalitySupport   1
      Lowest fully-functional device speed is Full Speed (12Mbps)
    bU1DevExitLat          10 micro seconds
    bU2DevExitLat          32 micro seconds
Device Status:     0x000c
  (Bus Powered)
  U1 Enabled
  U2 Enabled

Bus 002 Device 001: ID 1d6b:0003 Linux Foundation 3.0 root hub
Device Descriptor:
  bLength                18
  bDescriptorType         1
  bcdUSB               3.10
  bDeviceClass            9 Hub
  bDeviceSubClass         0 Unused
  bDeviceProtocol         3 
  bMaxPacketSize0         9
  idVendor           0x1d6b Linux Foundation
  idProduct          0x0003 3.0 root hub
  bcdDevice            5.04
  iManufacturer           3 
  iProduct                2 
  iSerial                 1 
  bNumConfigurations      1
  Configuration Descriptor:
    bLength                 9
    bDescriptorType         2
    wTotalLength           31
    bNumInterfaces          1
    bConfigurationValue     1
    iConfiguration          0 
    bmAttributes         0xe0
      Self Powered
      Remote Wakeup
    MaxPower                0mA
    Interface Descriptor:
      bLength                 9
      bDescriptorType         4
      bInterfaceNumber        0
      bAlternateSetting       0
      bNumEndpoints           1
      bInterfaceClass         9 Hub
      bInterfaceSubClass      0 Unused
      bInterfaceProtocol      0 Full speed (or root) hub
      iInterface              0 
      Endpoint Descriptor:
        bLength                 7
        bDescriptorType         5
        bEndpointAddress     0x81  EP 1 IN
        bmAttributes            3
          Transfer Type            Interrupt
          Synch Type               None
          Usage Type               Data
        wMaxPacketSize     0x0004  1x 4 bytes
        bInterval              12
        bMaxBurst               0

Bus 001 Device 004: ID 2341:0043 Arduino SA Uno R3 (CDC ACM)
Device Descriptor:
  bLength                18
  bDescriptorType         1
  bcdUSB               1.10
  bDeviceClass            2 Communications
  bDeviceSubClass         0 
  bDeviceProtocol         0 
  bMaxPacketSize0         8
  idVendor           0x2341 Arduino SA
  idProduct          0x0043 Uno R3 (CDC ACM)
  bcdDevice            0.01
  iManufacturer           1 
  iProduct                2 
  iSerial               220 
  bNumConfigurations      1
  Configuration Descriptor:
    bLength                 9
    bDescriptorType         2
    wTotalLength           62
    bNumInterfaces          2
    bConfigurationValue     1
    iConfiguration          0 
    bmAttributes         0xc0
      Self Powered
    MaxPower              100mA
    Interface Descriptor:
      bLength                 9
      bDescriptorType         4
      bInterfaceNumber        0
      bAlternateSetting       0
      bNumEndpoints           1
      bInterfaceClass         2 Communications
      bInterfaceSubClass      2 Abstract (modem)
      bInterfaceProtocol      1 AT-commands (v.25ter)
      iInterface              0 
      CDC Header:
        bcdCDC               10.01
      CDC ACM:
        bmCapabilities       0x06
          sends break
          line coding and serial state
      CDC Union:
        bMasterInterface        0
        bSlaveInterface         1 
      Endpoint Descriptor:
        bLength                 7
        bDescriptorType         5
        bEndpointAddress     0x82  EP 2 IN
        bmAttributes            3
          Transfer Type            Interrupt
          Synch Type               None
          Usage Type               Data
        wMaxPacketSize     0x0008  1x 8 bytes
        bInterval             255
    Interface Descriptor:
      bLength                 9
      bDescriptorType         4
      bInterfaceNumber        1
      bAlternateSetting       0
      bNumEndpoints           2
      bInterfaceClass        10 CDC Data
      bInterfaceSubClass      0 Unused
      bInterfaceProtocol      0 
      iInterface              0 
      Endpoint Descriptor:
        bLength                 7
        bDescriptorType         5
        bEndpointAddress     0x04  EP 4 OUT
        bmAttributes            2
          Transfer Type            Bulk
          Synch Type               None
          Usage Type               Data
        wMaxPacketSize     0x0040  1x 64 bytes
        bInterval               1
      Endpoint Descriptor:
        bLength                 7
        bDescriptorType         5
        bEndpointAddress     0x83  EP 3 IN
        bmAttributes            2
          Transfer Type            Bulk
          Synch Type               None
          Usage Type               Data
        wMaxPacketSize     0x0040  1x 64 bytes
        bInterval               1

Bus 001 Device 003: ID 2575:0001  
Device Descriptor:
  bLength                18
  bDescriptorType         1
  bcdUSB               2.00
  bDeviceClass            0 (Defined at Interface level)
  bDeviceSubClass         0 
  bDeviceProtocol         0 
  bMaxPacketSize0        64
  idVendor           0x2575 
  idProduct          0x0001 
  bcdDevice           31.00
  iManufacturer           1 
  iProduct                2 
  iSerial                 0 
  bNumConfigurations      1
  Configuration Descriptor:
    bLength                 9
    bDescriptorType         2
    wTotalLength           34
    bNumInterfaces          1
    bConfigurationValue     1
    iConfiguration          3 
    bmAttributes         0x80
      (Bus Powered)
    MaxPower              500mA
    Interface Descriptor:
      bLength                 9
      bDescriptorType         4
      bInterfaceNumber        0
      bAlternateSetting       0
      bNumEndpoints           1
      bInterfaceClass         3 Human Interface Device
      bInterfaceSubClass      0 No Subclass
      bInterfaceProtocol      0 None
      iInterface              4 
        HID Device Descriptor:
          bLength                 9
          bDescriptorType        33
          bcdHID               1.10
          bCountryCode            0 Not supported
          bNumDescriptors         1
          bDescriptorType        34 Report
          wDescriptorLength     735
         Report Descriptors: 
           ** UNAVAILABLE **
      Endpoint Descriptor:
        bLength                 7
        bDescriptorType         5
        bEndpointAddress     0x81  EP 1 IN
        bmAttributes            3
          Transfer Type            Interrupt
          Synch Type               None
          Usage Type               Data
        wMaxPacketSize     0x0040  1x 64 bytes
        bInterval               1

Bus 001 Device 002: ID 1e10:4000 Point Grey Research, Inc. 
Device Descriptor:
  bLength                18
  bDescriptorType         1
  bcdUSB               2.10
  bDeviceClass          239 Miscellaneous Device
  bDeviceSubClass         2 ?
  bDeviceProtocol         1 Interface Association
  bMaxPacketSize0        64
  idVendor           0x1e10 Point Grey Research, Inc.
  idProduct          0x4000 
  bcdDevice            0.00
  iManufacturer           1 (error)
  iProduct                2 (error)
  iSerial                 3 (error)
  bNumConfigurations      1
  Configuration Descriptor:
    bLength                 9
    bDescriptorType         2
    wTotalLength           92
    bNumInterfaces          3
    bConfigurationValue     1
    iConfiguration          0 
    bmAttributes         0x80
      (Bus Powered)
    MaxPower              150mA
    Interface Association:
      bLength                 8
      bDescriptorType        11
      bFirstInterface         0
      bInterfaceCount         3
      bFunctionClass        239 Miscellaneous Device
      bFunctionSubClass       5 USB3 Vision
      bFunctionProtocol       0 
      iFunction               4 (error)
    Interface Descriptor:
      bLength                 9
      bDescriptorType         4
      bInterfaceNumber        0
      bAlternateSetting       0
      bNumEndpoints           2
      bInterfaceClass       239 Miscellaneous Device
      bInterfaceSubClass      5 USB3 Vision
      bInterfaceProtocol      0 
      iInterface              5 (error)
      ** UNRECOGNIZED:  14 24 01 00 00 01 00 00 00 01 00 06 07 08 09 0a 0b 03 0c 0c
      Endpoint Descriptor:
        bLength                 7
        bDescriptorType         5
        bEndpointAddress     0x02  EP 2 OUT
        bmAttributes            2
          Transfer Type            Bulk
          Synch Type               None
          Usage Type               Data
        wMaxPacketSize     0x0200  1x 512 bytes
        bInterval               0
      Endpoint Descriptor:
        bLength                 7
        bDescriptorType         5
        bEndpointAddress     0x82  EP 2 IN
        bmAttributes            2
          Transfer Type            Bulk
          Synch Type               None
          Usage Type               Data
        wMaxPacketSize     0x0200  1x 512 bytes
        bInterval               0
    Interface Descriptor:
      bLength                 9
      bDescriptorType         4
      bInterfaceNumber        1
      bAlternateSetting       0
      bNumEndpoints           1
      bInterfaceClass       239 Miscellaneous Device
      bInterfaceSubClass      5 USB3 Vision
      bInterfaceProtocol      1 
      iInterface             13 (error)
      Endpoint Descriptor:
        bLength                 7
        bDescriptorType         5
        bEndpointAddress     0x83  EP 3 IN
        bmAttributes            2
          Transfer Type            Bulk
          Synch Type               None
          Usage Type               Data
        wMaxPacketSize     0x0200  1x 512 bytes
        bInterval               0
    Interface Descriptor:
      bLength                 9
      bDescriptorType         4
      bInterfaceNumber        2
      bAlternateSetting       0
      bNumEndpoints           1
      bInterfaceClass       239 Miscellaneous Device
      bInterfaceSubClass      5 USB3 Vision
      bInterfaceProtocol      2 
      iInterface             14 (error)
      Endpoint Descriptor:
        bLength                 7
        bDescriptorType         5
        bEndpointAddress     0x81  EP 1 IN
        bmAttributes            2
          Transfer Type            Bulk
          Synch Type               None
          Usage Type               Data
        wMaxPacketSize     0x0200  1x 512 bytes
        bInterval               0
Device Status:     0x000c
  (Bus Powered)
  Test Mode

Bus 001 Device 001: ID 1d6b:0002 Linux Foundation 2.0 root hub
Device Descriptor:
  bLength                18
  bDescriptorType         1
  bcdUSB               2.00
  bDeviceClass            9 Hub
  bDeviceSubClass         0 Unused
  bDeviceProtocol         1 Single TT
  bMaxPacketSize0        64
  idVendor           0x1d6b Linux Foundation
  idProduct          0x0002 2.0 root hub
  bcdDevice            5.04
  iManufacturer           3 
  iProduct                2 
  iSerial                 1 
  bNumConfigurations      1
  Configuration Descriptor:
    bLength                 9
    bDescriptorType         2
    wTotalLength           25
    bNumInterfaces          1
    bConfigurationValue     1
    iConfiguration          0 
    bmAttributes         0xe0
      Self Powered
      Remote Wakeup
    MaxPower                0mA
    Interface Descriptor:
      bLength                 9
      bDescriptorType         4
      bInterfaceNumber        0
      bAlternateSetting       0
      bNumEndpoints           1
      bInterfaceClass         9 Hub
      bInterfaceSubClass      0 Unused
      bInterfaceProtocol      0 Full speed (or root) hub
      iInterface              0 
      Endpoint Descriptor:
        bLength                 7
        bDescriptorType         5
        bEndpointAddress     0x81  EP 1 IN
        bmAttributes            3
          Transfer Type            Interrupt
          Synch Type               None
          Usage Type               Data
        wMaxPacketSize     0x0004  1x 4 bytes
        bInterval              12

Bus 004 Device 001: ID 1d6b:0003 Linux Foundation 3.0 root hub
Device Descriptor:
  bLength                18
  bDescriptorType         1
  bcdUSB               3.10
  bDeviceClass            9 Hub
  bDeviceSubClass         0 Unused
  bDeviceProtocol         3 
  bMaxPacketSize0         9
  idVendor           0x1d6b Linux Foundation
  idProduct          0x0003 3.0 root hub
  bcdDevice            5.04
  iManufacturer           3 
  iProduct                2 
  iSerial                 1 
  bNumConfigurations      1
  Configuration Descriptor:
    bLength                 9
    bDescriptorType         2
    wTotalLength           31
    bNumInterfaces          1
    bConfigurationValue     1
    iConfiguration          0 
    bmAttributes         0xe0
      Self Powered
      Remote Wakeup
    MaxPower                0mA
    Interface Descriptor:
      bLength                 9
      bDescriptorType         4
      bInterfaceNumber        0
      bAlternateSetting       0
      bNumEndpoints           1
      bInterfaceClass         9 Hub
      bInterfaceSubClass      0 Unused
      bInterfaceProtocol      0 Full speed (or root) hub
      iInterface              0 
      Endpoint Descriptor:
        bLength                 7
        bDescriptorType         5
        bEndpointAddress     0x81  EP 1 IN
        bmAttributes            3
          Transfer Type            Interrupt
          Synch Type               None
          Usage Type               Data
        wMaxPacketSize     0x0004  1x 4 bytes
        bInterval              12
        bMaxBurst               0

Bus 003 Device 001: ID 1d6b:0002 Linux Foundation 2.0 root hub
Device Descriptor:
  bLength                18
  bDescriptorType         1
  bcdUSB               2.00
  bDeviceClass            9 Hub
  bDeviceSubClass         0 Unused
  bDeviceProtocol         1 Single TT
  bMaxPacketSize0        64
  idVendor           0x1d6b Linux Foundation
  idProduct          0x0002 2.0 root hub
  bcdDevice            5.04
  iManufacturer           3 
  iProduct                2 
  iSerial                 1 
  bNumConfigurations      1
  Configuration Descriptor:
    bLength                 9
    bDescriptorType         2
    wTotalLength           25
    bNumInterfaces          1
    bConfigurationValue     1
    iConfiguration          0 
    bmAttributes         0xe0
      Self Powered
      Remote Wakeup
    MaxPower                0mA
    Interface Descriptor:
      bLength                 9
      bDescriptorType         4
      bInterfaceNumber        0
      bAlternateSetting       0
      bNumEndpoints           1
      bInterfaceClass         9 Hub
      bInterfaceSubClass      0 Unused
      bInterfaceProtocol      0 Full speed (or root) hub
      iInterface              0 
      Endpoint Descriptor:
        bLength                 7
        bDescriptorType         5
        bEndpointAddress     0x81  EP 1 IN
        bmAttributes            3
          Transfer Type            Interrupt
          Synch Type               None
          Usage Type               Data
        wMaxPacketSize     0x0004  1x 4 bytes
        bInterval              12


USBFS:

1000


ifconfig -a:

br-f174530faf0e: flags=4163<UP,BROADCAST,RUNNING,MULTICAST>  mtu 1500
        inet 172.19.0.1  netmask 255.255.0.0  broadcast 172.19.255.255
        inet6 fe80::42:b7ff:fe9d:a19c  prefixlen 64  scopeid 0x20<link>
        ether 02:42:b7:9d:a1:9c  txqueuelen 0  (Ethernet)
        RX packets 40068  bytes 415483790 (415.4 MB)
        RX errors 0  dropped 0  overruns 0  frame 0
        TX packets 88740  bytes 13341894 (13.3 MB)
        TX errors 0  dropped 0 overruns 0  carrier 0  collisions 0

docker0: flags=4099<UP,BROADCAST,MULTICAST>  mtu 1500
        inet 172.17.0.1  netmask 255.255.0.0  broadcast 172.17.255.255
        inet6 fe80::42:5fff:fe93:1afa  prefixlen 64  scopeid 0x20<link>
        ether 02:42:5f:93:1a:fa  txqueuelen 0  (Ethernet)
        RX packets 0  bytes 0 (0.0 B)
        RX errors 0  dropped 0  overruns 0  frame 0
        TX packets 4  bytes 482 (482.0 B)
        TX errors 0  dropped 0 overruns 0  carrier 0  collisions 0

eno1: flags=4163<UP,BROADCAST,RUNNING,MULTICAST>  mtu 1500
        inet 132.66.44.221  netmask 255.255.0.0  broadcast 132.66.255.255
        inet6 fe80::ab37:ba66:7245:6281  prefixlen 64  scopeid 0x20<link>
        ether 70:85:c2:c7:5c:ed  txqueuelen 1000  (Ethernet)
        RX packets 4598576  bytes 2858138355 (2.8 GB)
        RX errors 0  dropped 0  overruns 0  frame 0
        TX packets 6654733  bytes 9831751739 (9.8 GB)
        TX errors 0  dropped 0 overruns 0  carrier 0  collisions 0
        device interrupt 16  memory 0xa4200000-a4220000  

lo: flags=73<UP,LOOPBACK,RUNNING>  mtu 65536
        inet 127.0.0.1  netmask 255.0.0.0
        inet6 ::1  prefixlen 128  scopeid 0x10<host>
        loop  txqueuelen 1000  (Local Loopback)
        RX packets 6106  bytes 4658727 (4.6 MB)
        RX errors 0  dropped 0  overruns 0  frame 0
        TX packets 6106  bytes 4658727 (4.6 MB)
        TX errors 0  dropped 0 overruns 0  carrier 0  collisions 0

veth10816e7: flags=4163<UP,BROADCAST,RUNNING,MULTICAST>  mtu 1500
        inet6 fe80::d4c0:1ff:fece:d36  prefixlen 64  scopeid 0x20<link>
        ether d6:c0:01:ce:0d:36  txqueuelen 0  (Ethernet)
        RX packets 44  bytes 470994 (470.9 KB)
        RX errors 0  dropped 0  overruns 0  frame 0
        TX packets 2290  bytes 2309776 (2.3 MB)
        TX errors 0  dropped 0 overruns 0  carrier 0  collisions 0

veth2a2b4ee: flags=4163<UP,BROADCAST,RUNNING,MULTICAST>  mtu 1500
        inet6 fe80::50eb:77ff:fe72:564b  prefixlen 64  scopeid 0x20<link>
        ether 52:eb:77:72:56:4b  txqueuelen 0  (Ethernet)
        RX packets 237  bytes 19356 (19.3 KB)
        RX errors 0  dropped 0  overruns 0  frame 0
        TX packets 12102  bytes 11880245 (11.8 MB)
        TX errors 0  dropped 0 overruns 0  carrier 0  collisions 0

veth2d7bc20: flags=4163<UP,BROADCAST,RUNNING,MULTICAST>  mtu 1500
        inet6 fe80::94c9:c0ff:fefc:fd1c  prefixlen 64  scopeid 0x20<link>
        ether 96:c9:c0:fc:fd:1c  txqueuelen 0  (Ethernet)
        RX packets 746  bytes 48827 (48.8 KB)
        RX errors 0  dropped 0  overruns 0  frame 0
        TX packets 12570  bytes 11906991 (11.9 MB)
        TX errors 0  dropped 0 overruns 0  carrier 0  collisions 0

veth35a9528: flags=4163<UP,BROADCAST,RUNNING,MULTICAST>  mtu 1500
        inet6 fe80::1ccf:aaff:fe05:e8fa  prefixlen 64  scopeid 0x20<link>
        ether 1e:cf:aa:05:e8:fa  txqueuelen 0  (Ethernet)
        RX packets 561  bytes 39303 (39.3 KB)
        RX errors 0  dropped 0  overruns 0  frame 0
        TX packets 12067  bytes 11875272 (11.8 MB)
        TX errors 0  dropped 0 overruns 0  carrier 0  collisions 0

veth51459e2: flags=4163<UP,BROADCAST,RUNNING,MULTICAST>  mtu 1500
        inet6 fe80::f0ce:caff:fe88:1c9f  prefixlen 64  scopeid 0x20<link>
        ether f2:ce:ca:88:1c:9f  txqueuelen 0  (Ethernet)
        RX packets 39864  bytes 415468476 (415.4 MB)
        RX errors 0  dropped 0  overruns 0  frame 0
        TX packets 91880  bytes 17245014 (17.2 MB)
        TX errors 0  dropped 0 overruns 0  carrier 0  collisions 0



ls -l /usr/lib/libfly*:



ls -l /usr/lib/libSpin*:

lrwxrwxrwx 1 root root       18 Oct  7  2019 /usr/lib/libSpinUpdate.so -> libSpinUpdate.so.1
lrwxrwxrwx 1 root root       26 Oct  7  2019 /usr/lib/libSpinUpdate.so.1 -> libSpinUpdate.so.1.27.0.48
-rw-r--r-- 1 root root  5033320 Oct  7  2019 /usr/lib/libSpinUpdate.so.1.27.0.48
lrwxrwxrwx 1 root root       17 Oct  7  2019 /usr/lib/libSpinVideo.so -> libSpinVideo.so.1
lrwxrwxrwx 1 root root       25 Oct  7  2019 /usr/lib/libSpinVideo.so.1 -> libSpinVideo.so.1.27.0.48
-rw-r--r-- 1 root root 10145512 Oct  7  2019 /usr/lib/libSpinVideo.so.1.27.0.48
lrwxrwxrwx 1 root root       19 Oct  7  2019 /usr/lib/libSpinVideo_C.so -> libSpinVideo_C.so.1
lrwxrwxrwx 1 root root       27 Oct  7  2019 /usr/lib/libSpinVideo_C.so.1 -> libSpinVideo_C.so.1.27.0.48
-rw-r--r-- 1 root root    68296 Oct  7  2019 /usr/lib/libSpinVideo_C.so.1.27.0.48
lrwxrwxrwx 1 root root       17 Oct  7  2019 /usr/lib/libSpinnaker.so -> libSpinnaker.so.1
lrwxrwxrwx 1 root root       25 Feb 25 12:14 /usr/lib/libSpinnaker.so.1 -> libSpinnaker.so.1.27.0.48
-rw-r--r-- 1 root root 38853112 Oct  7  2019 /usr/lib/libSpinnaker.so.1.27.0.48
lrwxrwxrwx 1 root root       19 Oct  7  2019 /usr/lib/libSpinnaker_C.so -> libSpinnaker_C.so.1
lrwxrwxrwx 1 root root       27 Feb 25 12:14 /usr/lib/libSpinnaker_C.so.1 -> libSpinnaker_C.so.1.27.0.48
-rw-r--r-- 1 root root  1740128 Oct  7  2019 /usr/lib/libSpinnaker_C.so.1.27.0.48
